{
  "spec_id": "supertrend-btc-sandbox-001",
  "generation": 1,
  "trading_mode": "sandbox",
  "lifecycle_state": "running",
  "strategy_path": "/opt/custos/strategies/supertrend/strategy.py",
  "code_hash": null,
  "connector": "binance_perpetual",
  "pairs": ["BTC-USDT"],
  "leverage": 3,
  "log_level": "INFO",
  "sandbox": {
    "starting_balances": ["10_000 USDT"]
  },
  "provenance_ref": {
    "credential_id": "binance-sandbox-key"
  }
}
